League,Fixtures,Tip,Odd,Match Time,Score,Date,Match Date,Result,Code,Source
Algeria: Ligue 1,CR Belouizdad vs Ben Aknoun,HOME DC,1.3,19:00,?:?,2026-05-24,2026-05-24,?,whdnfffs282286202,pro_tips
Canada: Canadian Premier League,Cavalry FC vs Pacific FC,HOME DC,1.42,21:00,?:?,2026-05-24,2026-05-24,?,vgmzbiea314157785,pro_tips
Peru: Primera División,Sport Huancayo vs Cienciano,HOME DC,2.06,18:15,?:?,2026-05-24,2026-05-24,?,lxevywbg75896129,pro_tips
Poland: I Liga,Odra Opole vs Polonia Warszawa,AWAY DC,1.91,14:30,?:?,2026-05-24,2026-05-24,?,uanapvzn165782798,pro_tips
World: CAF Champions League,FAR Rabat vs Mamelodi Sundowns,HOME DC,2.41,19:00,?:?,2026-05-24,2026-05-24,?,qspvshrb313708767,pro_tips
Spain: Segunda División,Mirandes vs Granada CF,HOME DC,1.45,16:30,?:?,2026-05-24,2026-05-24,?,moaabazi141637996,pro_tips
Argentina: Liga Profesional Argentina,River Plate vs Belgrano Cordoba,HOME DC,2.06,18:30,?:?,2026-05-24,2026-05-24,?,cbnswzbw47077237,pro_tips
Portugal: Taça de Portugal,Sporting CP vs Torreense,HOME DC,1.12,16:15,?:?,2026-05-24,2026-05-24,?,hfvxejsj318505553,pro_tips
Serbia: Super Liga,Radnicki 1923 vs Javor,HOME DC,1.36,17:30,?:?,2026-05-24,2026-05-24,?,beqwwuku259290034,pro_tips
Italy: Serie C - Promotion - Play-offs,Ascoli vs Catania,HOME DC,2.16,18:00,?:?,2026-05-24,2026-05-24,?,fxkujqxl296151742,pro_tips
Montenegro: First League,Bokelj vs Dečić,HOME DC,1.67,18:00,?:?,2026-05-24,2026-05-24,?,ghcdhepn14205442,pro_tips
Bosnia: 1st League - FBiH,Čelik vs Radnik Hadžići,HOME DC,1.3,15:30,?:?,2026-05-24,2026-05-24,?,rlqufiek204669540,pro_tips
Costa-Rica: Liga de Ascenso,ADR Jicaral vs Inter San Carlos,HOME DC,2.11,17:00,?:?,2026-05-24,2026-05-24,?,qqelijqi185796717,pro_tips
Poland: I Liga,Wieczysta Kraków vs Chrobry Głogów,HOME DC,1.57,14:30,?:?,2026-05-24,2026-05-24,?,funhjahp236134786,pro_tips
Serbia: Super Liga,Mladost Lucani vs Napredak,HOME DC,1.12,17:30,?:?,2026-05-24,2026-05-24,?,xxudnnms214059670,pro_tips
England: Premier League,Tottenham vs Everton,HOME DC,1.91,15:00,?:?,2026-05-24,2026-05-24,?,ptavocfr264785921,pro_tips
England: Premier League,Nottingham Forest vs Bournemouth,AWAY DC,2.06,15:00,?:?,2026-05-24,2026-05-24,?,yyjwbpiu324860723,pro_tips
Poland: I Liga,Stal Mielec vs Polonia Bytom,HOME DC,2.36,14:30,?:?,2026-05-24,2026-05-24,?,kiifazfb222207732,pro_tips
Montenegro: First League,Sutjeska vs Jedinstvo,HOME DC,2.11,18:00,?:?,2026-05-24,2026-05-24,?,cbmmrgia67747070,pro_tips
Brazil: Serie D,ABC vs America-RN,HOME DC,2.41,19:00,?:?,2026-05-24,2026-05-24,?,tvjmalus126705856,pro_tips
Spain: Segunda División,Huesca vs Castellón,AWAY DC,1.65,16:30,?:?,2026-05-24,2026-05-24,?,iyhmxznz253030359,pro_tips
Serbia: Super Liga,Radnicki NIS vs FK Spartak Zdrepceva KRV,HOME DC,1.28,17:30,?:?,2026-05-24,2026-05-24,?,avvdlmre279657698,pro_tips
Tanzania: Ligi kuu Bara,Simba vs Dodoma Jiji,HOME DC,1.17,15:15,?:?,2026-05-24,2026-05-24,?,jzfpmuuh207462135,pro_tips
Spain: Segunda División,Eibar vs Cordoba,HOME DC,1.67,16:30,?:?,2026-05-24,2026-05-24,?,gayhizrr243870339,pro_tips
England: Premier League,Sunderland vs Chelsea,AWAY DC,2.06,15:00,?:?,2026-05-24,2026-05-24,?,fjastzyl33834516,pro_tips
Montenegro: First League,Jezero vs Mornar,AWAY DC,2.41,18:00,?:?,2026-05-24,2026-05-24,?,tuhbwjex7987015,pro_tips
Sweden: Allsvenskan,Malmo FF vs Vasteras SK FK,HOME DC,1.62,14:30,?:?,2026-05-24,2026-05-24,?,bhvimcbn302936595,pro_tips
England: Premier League,Liverpool vs Brentford,HOME DC,1.91,15:00,?:?,2026-05-24,2026-05-24,?,ftjrtany98582776,pro_tips
Spain: Primera División RFEF - Group 2,Real Murcia vs Eldense,HOME DC,2.31,16:00,?:?,2026-05-24,2026-05-24,?,yxqumqvf214338320,pro_tips
Brazil: Serie D,Araguaína vs Porto Velho,HOME DC,2.36,19:00,?:?,2026-05-24,2026-05-24,?,tzzggqjy2350404,pro_tips
Poland: I Liga,Wisla Krakow vs Pogoń Siedlce,HOME DC,1.3,14:30,?:?,2026-05-24,2026-05-24,?,xfdpdrup323902343,pro_tips
Spain: Tercera División RFEF - Group 9,Motril vs Churriana Vega,HOME DC,1.5,17:00,?:?,2026-05-24,2026-05-24,?,rdtuvpny99894485,pro_tips
Serbia: Super Liga,IMT Novi Beograd vs TSC Backa Topola,AWAY DC,1.6,17:30,?:?,2026-05-24,2026-05-24,?,hyvjawxt114389760,pro_tips
Peru: Segunda División,Carlos A. Mannucci vs Molinos El Pirata,HOME DC,1.7,20:30,?:?,2026-05-24,2026-05-24,?,lkpdvhcj49888085,pro_tips
Spain: Tercera División RFEF - Group 18,Toledo vs Albacete II,HOME DC,1.65,16:00,?:?,2026-05-24,2026-05-24,?,tyuumfas12942443,pro_tips
Peru: Primera División,Alianza Atletico vs FC Cajamarca,HOME DC,1.6,20:30,?:?,2026-05-24,2026-05-24,?,unskgxky89516265,pro_tips
Argentina: Torneo Federal A,Cipolletti vs Atenas,HOME DC,1.86,18:30,?:?,2026-05-24,2026-05-24,?,fmkmdbvn149596193,pro_tips
Spain: Segunda División RFEF - Play-offs,CD Coria vs Real Oviedo II,AWAY DC,2.21,17:00,?:?,2026-05-24,2026-05-24,?,wbpgljbp164621046,pro_tips
Argentina: Torneo Federal A,Alvarado vs Olimpo Bahia Blanca,HOME DC,2.06,15:15,?:?,2026-05-24,2026-05-24,?,jfuaithb328210784,pro_tips
Spain: Tercera División RFEF - Group 3,Tropezón vs Guarnizo,HOME DC,2.01,16:00,?:?,2026-05-24,2026-05-24,?,bnhuhuvz148651434,pro_tips
Poland: I Liga,Znicz Pruszków vs Ruch Chorzów,AWAY DC,1.6,14:30,?:?,2026-05-24,2026-05-24,?,ueqtcxyx198763900,pro_tips
Argentina: Primera Nacional,Chaco For Ever vs Deportivo Madryn,HOME DC,2.36,19:00,?:?,2026-05-24,2026-05-24,?,jeyjhnti326057141,pro_tips
Belgium: Jupiler Pro League,St. Truiden vs KV Mechelen,HOME DC,1.86,16:30,?:?,2026-05-24,2026-05-24,?,hdkgyhiy313005961,pro_tips
Morocco: Botola Pro,Renaissance Berkane vs CR Khemis Zemamra,HOME DC,1.38,17:00,?:?,2026-05-24,2026-05-24,?,lsfnigch67471603,pro_tips
Brazil: Serie A,Cruzeiro vs Chapecoense-sc,HOME DC,1.33,19:00,?:?,2026-05-24,2026-05-24,?,zcnzrowu266974135,pro_tips
